{
 "cells": [
  {
   "attachments": {},
   "cell_type": "markdown",
   "id": "865d3b1a-fba9-4477-8172-1f7debc6df6d",
   "metadata": {},
   "source": [
    "# DSCI Project Planning Stage (Individual)\n",
    "### Amanda Ren\n",
    "## 1. Data Description\n",
    "- **Players.csv:** Information about each player.\n",
    "  - experience: Character level.\n",
    "  - subscribe: Subscription to newsletter\n",
    "  - hashedEmail: Something to identify player.\n",
    "  - played_hours: Total hours played\n",
    "  - name: Player's first name\n",
    "  - gender: Gender identity\n",
    "  - age: Players' age(missing some values)\n",
    "****\n",
    "- **Sessions.csv:**\n",
    "  - session_id: Session identifier.\n",
    "  - player_id: Links to players.csv.\n",
    "  - start_time & end_time: Time sessions began/ended.\n",
    "  - duration_minutes: Duration of session.\n",
    "  - blocks_placed & blocks_destroyed: Number of blocks placed/destroyed.\n",
    "  - items_collected: Items gathered"
   ]
  },
  {
   "cell_type": "code",
   "execution_count": null,
   "id": "381cb604-1a20-4145-98e7-85ca9502ade6",
   "metadata": {},
   "outputs": [],
   "source": [
    "library(tidyverse)\n",
    "library(lubridate)\n",
    "library(GGally)\n",
    "library(scales)\n",
    "\n",
    "set.seed(2000)\n",
    "\n",
    "players <- read_csv(\"players.csv\")\n",
    "sessions <- read_csv(\"sessions.csv\")\n",
    "\n",
    "players\n",
    "sessions"
   ]
  },
  {
   "cell_type": "code",
   "execution_count": null,
   "id": "42109794-e401-4761-8bd6-0d195e4ae5c8",
   "metadata": {},
   "outputs": [],
   "source": [
    "nrow(players)\n",
    "ncol(players)\n",
    "str(players)"
   ]
  },
  {
   "cell_type": "code",
   "execution_count": null,
   "id": "69132a01-b0a5-423e-9cbb-15228a9239e9",
   "metadata": {},
   "outputs": [],
   "source": [
    "summary_players <- data.frame(\n",
    "    Variable = names(players),\n",
    "    Summary = sapply(players, function(x) if(is.numeric(x)) round(mean(x, na.rm = TRUE), 2) else \"N/A\")\n",
    "        )\n",
    "summary_players"
   ]
  },
  {
   "cell_type": "code",
   "execution_count": null,
   "id": "e106ddbf-8b8b-41ed-b7fe-5d7c6e21dfd4",
   "metadata": {},
   "outputs": [],
   "source": [
    "nrow(sessions)\n",
    "ncol(sessions)\n",
    "str(sessions)"
   ]
  },
  {
   "cell_type": "code",
   "execution_count": null,
   "id": "17186191-b060-4109-83c0-cc95a9c3934b",
   "metadata": {},
   "outputs": [],
   "source": [
    "summary_sessions <- data.frame(\n",
    "    Variable = names(sessions),\n",
    "    Summary = sapply(sessions, function(x) if(is.numeric(x)) round(mean(x, na.rm = TRUE), 2) else \"N/A\")\n",
    "        )\n",
    "summary_sessions"
   ]
  },
  {
   "cell_type": "markdown",
   "id": "e455576f-e5c0-49ae-83dd-22a89d3da12a",
   "metadata": {},
   "source": [
    "**How data was collected:**\n",
    "- The data was recorded by a Minecraft server made by UBC’s Compsci department\n",
    "- Each event was logged with timestamps.\n",
    "****\n",
    "**Potential issues:**\n",
    "- Sessions cut off/missing timestamps because of disconnections.\n",
    "- Long play times & unrealistic activity.\n",
    "- Adjusting time zones\n",
    "- Players who join but don’t play appear in players.csv, not sessions.csv\n",
    "- Lagging/issues with connection."
   ]
  },
  {
   "cell_type": "markdown",
   "id": "62ea62f1-4bd4-4ffc-ae11-70cda9ac122c",
   "metadata": {},
   "source": [
    "## 2. Questions\n",
    "**Broad Question:** We are interested in demand forecasting…high probability (Question 3).\n",
    "  - This question is important since the server has limited resources & licenses. Predicting when the server will have the most players lets the team ensure there are enough licenses and server size to accommodate all players without lag/disconnection.\n",
    "****\n",
    "**Specific Question:** Can the days of the week and the hour of day predict the activity of players on the server in a specific time frame?\n",
    "  - This version of the question involves:\n",
    "    - Responsible variable: Number of active players in a given window.\n",
    "    - Explanatory variable: the day of week & hour of day from the start time of each session.\n",
    "****\n",
    "**Why this matters:** \n",
    "- Understanding will give admin a better allocation of resources.\n",
    "- Improving update schedules & maintenance to avoid peak times.\n",
    "- Targeted recruitment/engagement when players are least active.\n",
    "****\n",
    "**Data Needed**\n",
    "I will use sessions.csv, which contains timestamps and player activity. Then merge variables from players.csv (to check player demographics affecting activity times).\n"
   ]
  },
  {
   "cell_type": "code",
   "execution_count": 17,
   "id": "502407b3-fc92-4147-b4ca-609b99667fce",
   "metadata": {},
   "outputs": [
    {
     "data": {
      "text/html": [
       "<table class=\"dataframe\">\n",
       "<caption>A data.frame: 1535 × 8</caption>\n",
       "<thead>\n",
       "\t<tr><th scope=col>hashedEmail</th><th scope=col>start_time</th><th scope=col>end_time</th><th scope=col>original_start_time</th><th scope=col>original_end_time</th><th scope=col>start_time_parsed</th><th scope=col>days_of_week</th><th scope=col>hours_of_day</th></tr>\n",
       "\t<tr><th scope=col>&lt;chr&gt;</th><th scope=col>&lt;chr&gt;</th><th scope=col>&lt;chr&gt;</th><th scope=col>&lt;dbl&gt;</th><th scope=col>&lt;dbl&gt;</th><th scope=col>&lt;dttm&gt;</th><th scope=col>&lt;chr&gt;</th><th scope=col>&lt;int&gt;</th></tr>\n",
       "</thead>\n",
       "<tbody>\n",
       "\t<tr><td>bfce39c89d6549f2bb94d8064d3ce69dc3d7e72b38f431d8aa0c4bf95ccee6bf</td><td>30/06/2024 18:12</td><td>30/06/2024 18:24</td><td>1.71977e+12</td><td>1.71977e+12</td><td>2024-06-30 18:12:00</td><td>Sunday   </td><td>18</td></tr>\n",
       "\t<tr><td>36d9cbb4c6bc0c1a6911436d2da0d09ec625e43e6552f575d4acc9cf487c4686</td><td>17/06/2024 23:33</td><td>17/06/2024 23:46</td><td>1.71867e+12</td><td>1.71867e+12</td><td>2024-06-17 23:33:00</td><td>Monday   </td><td>23</td></tr>\n",
       "\t<tr><td>f8f5477f5a2e53616ae37421b1c660b971192bd8ff77e3398304c7ae42581fdc</td><td>25/07/2024 17:34</td><td>25/07/2024 17:57</td><td>1.72193e+12</td><td>1.72193e+12</td><td>2024-07-25 17:34:00</td><td>Thursday </td><td>17</td></tr>\n",
       "\t<tr><td>bfce39c89d6549f2bb94d8064d3ce69dc3d7e72b38f431d8aa0c4bf95ccee6bf</td><td>25/07/2024 03:22</td><td>25/07/2024 03:58</td><td>1.72188e+12</td><td>1.72188e+12</td><td>2024-07-25 03:22:00</td><td>Thursday </td><td> 3</td></tr>\n",
       "\t<tr><td>36d9cbb4c6bc0c1a6911436d2da0d09ec625e43e6552f575d4acc9cf487c4686</td><td>25/05/2024 16:01</td><td>25/05/2024 16:12</td><td>1.71665e+12</td><td>1.71665e+12</td><td>2024-05-25 16:01:00</td><td>Saturday </td><td>16</td></tr>\n",
       "\t<tr><td>bfce39c89d6549f2bb94d8064d3ce69dc3d7e72b38f431d8aa0c4bf95ccee6bf</td><td>23/06/2024 15:08</td><td>23/06/2024 17:10</td><td>1.71916e+12</td><td>1.71916e+12</td><td>2024-06-23 15:08:00</td><td>Sunday   </td><td>15</td></tr>\n",
       "\t<tr><td>fd6563a4e0f6f4273580e5fedbd8dda64990447aea5a33cbb5e894a3867ca44d</td><td>15/04/2024 07:12</td><td>15/04/2024 07:21</td><td>1.71317e+12</td><td>1.71317e+12</td><td>2024-04-15 07:12:00</td><td>Monday   </td><td> 7</td></tr>\n",
       "\t<tr><td>ad6390295640af1ed0e45ffc58a53b2d9074b0eea694b16210addd44d7c81f83</td><td>21/09/2024 02:13</td><td>21/09/2024 02:30</td><td>1.72688e+12</td><td>1.72689e+12</td><td>2024-09-21 02:13:00</td><td>Saturday </td><td> 2</td></tr>\n",
       "\t<tr><td>96e190b0bf3923cd8d349eee467c09d1130af143335779251492eb4c2c058a5f</td><td>21/06/2024 02:31</td><td>21/06/2024 02:49</td><td>1.71894e+12</td><td>1.71894e+12</td><td>2024-06-21 02:31:00</td><td>Friday   </td><td> 2</td></tr>\n",
       "\t<tr><td>36d9cbb4c6bc0c1a6911436d2da0d09ec625e43e6552f575d4acc9cf487c4686</td><td>16/05/2024 05:13</td><td>16/05/2024 05:52</td><td>1.71584e+12</td><td>1.71584e+12</td><td>2024-05-16 05:13:00</td><td>Thursday </td><td> 5</td></tr>\n",
       "\t<tr><td>fd6563a4e0f6f4273580e5fedbd8dda64990447aea5a33cbb5e894a3867ca44d</td><td>03/07/2024 01:31</td><td>03/07/2024 01:35</td><td>1.71997e+12</td><td>1.71997e+12</td><td>2024-07-03 01:31:00</td><td>Wednesday</td><td> 1</td></tr>\n",
       "\t<tr><td>f8f5477f5a2e53616ae37421b1c660b971192bd8ff77e3398304c7ae42581fdc</td><td>30/07/2024 15:15</td><td>30/07/2024 15:43</td><td>1.72235e+12</td><td>1.72235e+12</td><td>2024-07-30 15:15:00</td><td>Tuesday  </td><td>15</td></tr>\n",
       "\t<tr><td>f2826fb8dbce4d450348f99cb27ade184b713998d9679780442efaaf218038f2</td><td>24/08/2024 02:32</td><td>24/08/2024 03:12</td><td>1.72447e+12</td><td>1.72447e+12</td><td>2024-08-24 02:32:00</td><td>Saturday </td><td> 2</td></tr>\n",
       "\t<tr><td>b622593d2ef8b337dc554acb307d04a88114f2bf453b18fb5d2c80052aeb2319</td><td>18/08/2024 00:51</td><td>18/08/2024 03:15</td><td>1.72394e+12</td><td>1.72395e+12</td><td>2024-08-18 00:51:00</td><td>Sunday   </td><td> 0</td></tr>\n",
       "\t<tr><td>24d4892c2c3ce11d3e54c3bf31ee218901cac7a2f564911d67424c8fdf0874fe</td><td>23/05/2024 18:12</td><td>23/05/2024 18:22</td><td>1.71649e+12</td><td>1.71649e+12</td><td>2024-05-23 18:12:00</td><td>Thursday </td><td>18</td></tr>\n",
       "\t<tr><td>fd6563a4e0f6f4273580e5fedbd8dda64990447aea5a33cbb5e894a3867ca44d</td><td>11/07/2024 05:20</td><td>11/07/2024 05:57</td><td>1.72068e+12</td><td>1.72068e+12</td><td>2024-07-11 05:20:00</td><td>Thursday </td><td> 5</td></tr>\n",
       "\t<tr><td>88247d9a46fc214a12485dcbcbb03a8ddebfe8c1ec5fe209cd660147625c8e62</td><td>01/08/2024 23:12</td><td>01/08/2024 23:23</td><td>1.72255e+12</td><td>1.72255e+12</td><td>2024-08-01 23:12:00</td><td>Thursday </td><td>23</td></tr>\n",
       "\t<tr><td>f6daba428a5e19a3d47574858c13550499be23603422e6a0ee9728f8b53e192d</td><td>08/08/2024 00:21</td><td>08/08/2024 01:35</td><td>1.72308e+12</td><td>1.72308e+12</td><td>2024-08-08 00:21:00</td><td>Thursday </td><td> 0</td></tr>\n",
       "\t<tr><td>36d9cbb4c6bc0c1a6911436d2da0d09ec625e43e6552f575d4acc9cf487c4686</td><td>03/06/2024 00:22</td><td>03/06/2024 00:33</td><td>1.71737e+12</td><td>1.71737e+12</td><td>2024-06-03 00:22:00</td><td>Monday   </td><td> 0</td></tr>\n",
       "\t<tr><td>fd6563a4e0f6f4273580e5fedbd8dda64990447aea5a33cbb5e894a3867ca44d</td><td>31/07/2024 02:58</td><td>31/07/2024 03:21</td><td>1.72239e+12</td><td>1.72240e+12</td><td>2024-07-31 02:58:00</td><td>Wednesday</td><td> 2</td></tr>\n",
       "\t<tr><td>bfce39c89d6549f2bb94d8064d3ce69dc3d7e72b38f431d8aa0c4bf95ccee6bf</td><td>04/07/2024 02:25</td><td>04/07/2024 04:05</td><td>1.72006e+12</td><td>1.72007e+12</td><td>2024-07-04 02:25:00</td><td>Thursday </td><td> 2</td></tr>\n",
       "\t<tr><td>36d9cbb4c6bc0c1a6911436d2da0d09ec625e43e6552f575d4acc9cf487c4686</td><td>07/05/2024 19:23</td><td>07/05/2024 19:34</td><td>1.71511e+12</td><td>1.71511e+12</td><td>2024-05-07 19:23:00</td><td>Tuesday  </td><td>19</td></tr>\n",
       "\t<tr><td>fd6563a4e0f6f4273580e5fedbd8dda64990447aea5a33cbb5e894a3867ca44d</td><td>27/06/2024 21:40</td><td>27/06/2024 21:48</td><td>1.71952e+12</td><td>1.71952e+12</td><td>2024-06-27 21:40:00</td><td>Thursday </td><td>21</td></tr>\n",
       "\t<tr><td>ad6390295640af1ed0e45ffc58a53b2d9074b0eea694b16210addd44d7c81f83</td><td>30/05/2024 06:11</td><td>30/05/2024 06:57</td><td>1.71705e+12</td><td>1.71705e+12</td><td>2024-05-30 06:11:00</td><td>Thursday </td><td> 6</td></tr>\n",
       "\t<tr><td>ad6390295640af1ed0e45ffc58a53b2d9074b0eea694b16210addd44d7c81f83</td><td>26/07/2024 23:09</td><td>26/07/2024 23:16</td><td>1.72204e+12</td><td>1.72204e+12</td><td>2024-07-26 23:09:00</td><td>Friday   </td><td>23</td></tr>\n",
       "\t<tr><td>fd6563a4e0f6f4273580e5fedbd8dda64990447aea5a33cbb5e894a3867ca44d</td><td>09/07/2024 17:56</td><td>09/07/2024 18:02</td><td>1.72055e+12</td><td>1.72055e+12</td><td>2024-07-09 17:56:00</td><td>Tuesday  </td><td>17</td></tr>\n",
       "\t<tr><td>36d9cbb4c6bc0c1a6911436d2da0d09ec625e43e6552f575d4acc9cf487c4686</td><td>04/05/2024 21:41</td><td>04/05/2024 21:50</td><td>1.71486e+12</td><td>1.71486e+12</td><td>2024-05-04 21:41:00</td><td>Saturday </td><td>21</td></tr>\n",
       "\t<tr><td>bfce39c89d6549f2bb94d8064d3ce69dc3d7e72b38f431d8aa0c4bf95ccee6bf</td><td>26/06/2024 01:58</td><td>26/06/2024 03:35</td><td>1.71937e+12</td><td>1.71937e+12</td><td>2024-06-26 01:58:00</td><td>Wednesday</td><td> 1</td></tr>\n",
       "\t<tr><td>b622593d2ef8b337dc554acb307d04a88114f2bf453b18fb5d2c80052aeb2319</td><td>30/06/2024 16:21</td><td>30/06/2024 20:32</td><td>1.71976e+12</td><td>1.71978e+12</td><td>2024-06-30 16:21:00</td><td>Sunday   </td><td>16</td></tr>\n",
       "\t<tr><td>fd6563a4e0f6f4273580e5fedbd8dda64990447aea5a33cbb5e894a3867ca44d</td><td>22/08/2024 03:02</td><td>22/08/2024 03:49</td><td>1.72430e+12</td><td>1.72430e+12</td><td>2024-08-22 03:02:00</td><td>Thursday </td><td> 3</td></tr>\n",
       "\t<tr><td>⋮</td><td>⋮</td><td>⋮</td><td>⋮</td><td>⋮</td><td>⋮</td><td>⋮</td><td>⋮</td></tr>\n",
       "\t<tr><td>ad6390295640af1ed0e45ffc58a53b2d9074b0eea694b16210addd44d7c81f83</td><td>08/06/2024 16:14</td><td>08/06/2024 20:25</td><td>1.71786e+12</td><td>1.71788e+12</td><td>2024-06-08 16:14:00</td><td>Saturday </td><td>16</td></tr>\n",
       "\t<tr><td>bfce39c89d6549f2bb94d8064d3ce69dc3d7e72b38f431d8aa0c4bf95ccee6bf</td><td>02/06/2024 15:18</td><td>02/06/2024 16:53</td><td>1.71734e+12</td><td>1.71735e+12</td><td>2024-06-02 15:18:00</td><td>Sunday   </td><td>15</td></tr>\n",
       "\t<tr><td>bfce39c89d6549f2bb94d8064d3ce69dc3d7e72b38f431d8aa0c4bf95ccee6bf</td><td>22/05/2024 00:51</td><td>22/05/2024 01:22</td><td>1.71634e+12</td><td>1.71634e+12</td><td>2024-05-22 00:51:00</td><td>Wednesday</td><td> 0</td></tr>\n",
       "\t<tr><td>b3510c708bd50bf9f75e6e02bb6fe14edb705e0ea671ee769a45c613750e8b58</td><td>29/08/2024 03:42</td><td>29/08/2024 04:11</td><td>1.72490e+12</td><td>1.72490e+12</td><td>2024-08-29 03:42:00</td><td>Thursday </td><td> 3</td></tr>\n",
       "\t<tr><td>bfce39c89d6549f2bb94d8064d3ce69dc3d7e72b38f431d8aa0c4bf95ccee6bf</td><td>03/08/2024 22:33</td><td>04/08/2024 00:51</td><td>1.72272e+12</td><td>1.72273e+12</td><td>2024-08-03 22:33:00</td><td>Saturday </td><td>22</td></tr>\n",
       "\t<tr><td>e74c60a92c0100e7240be56d66969db85856152b048c639331a3595f901461ae</td><td>28/08/2024 19:00</td><td>28/08/2024 20:26</td><td>1.72487e+12</td><td>1.72488e+12</td><td>2024-08-28 19:00:00</td><td>Wednesday</td><td>19</td></tr>\n",
       "\t<tr><td>b622593d2ef8b337dc554acb307d04a88114f2bf453b18fb5d2c80052aeb2319</td><td>18/08/2024 21:54</td><td>19/08/2024 02:09</td><td>1.72402e+12</td><td>1.72403e+12</td><td>2024-08-18 21:54:00</td><td>Sunday   </td><td>21</td></tr>\n",
       "\t<tr><td>f8f5477f5a2e53616ae37421b1c660b971192bd8ff77e3398304c7ae42581fdc</td><td>23/05/2024 20:04</td><td>23/05/2024 20:20</td><td>1.71649e+12</td><td>1.71650e+12</td><td>2024-05-23 20:04:00</td><td>Thursday </td><td>20</td></tr>\n",
       "\t<tr><td>e74c60a92c0100e7240be56d66969db85856152b048c639331a3595f901461ae</td><td>22/07/2024 08:02</td><td>22/07/2024 08:07</td><td>1.72164e+12</td><td>1.72164e+12</td><td>2024-07-22 08:02:00</td><td>Monday   </td><td> 8</td></tr>\n",
       "\t<tr><td>fd6563a4e0f6f4273580e5fedbd8dda64990447aea5a33cbb5e894a3867ca44d</td><td>02/06/2024 01:17</td><td>02/06/2024 01:21</td><td>1.71729e+12</td><td>1.71729e+12</td><td>2024-06-02 01:17:00</td><td>Sunday   </td><td> 1</td></tr>\n",
       "\t<tr><td>f8f5477f5a2e53616ae37421b1c660b971192bd8ff77e3398304c7ae42581fdc</td><td>29/04/2024 04:14</td><td>29/04/2024 05:34</td><td>1.71436e+12</td><td>1.71437e+12</td><td>2024-04-29 04:14:00</td><td>Monday   </td><td> 4</td></tr>\n",
       "\t<tr><td>a1e0438d568b9c05a93cadaf99969e4d44794d19dea31edd723cbc916f878c33</td><td>27/04/2024 04:05</td><td>27/04/2024 05:48</td><td>1.71419e+12</td><td>1.71420e+12</td><td>2024-04-27 04:05:00</td><td>Saturday </td><td> 4</td></tr>\n",
       "\t<tr><td>fd6563a4e0f6f4273580e5fedbd8dda64990447aea5a33cbb5e894a3867ca44d</td><td>30/07/2024 03:44</td><td>30/07/2024 03:54</td><td>1.72231e+12</td><td>1.72231e+12</td><td>2024-07-30 03:44:00</td><td>Tuesday  </td><td> 3</td></tr>\n",
       "\t<tr><td>36d9cbb4c6bc0c1a6911436d2da0d09ec625e43e6552f575d4acc9cf487c4686</td><td>28/05/2024 03:58</td><td>28/05/2024 04:04</td><td>1.71687e+12</td><td>1.71687e+12</td><td>2024-05-28 03:58:00</td><td>Tuesday  </td><td> 3</td></tr>\n",
       "\t<tr><td>55d24216db39c27e1f17cc43d3127cbf8ed76ada6d098202b53ded319855e2c1</td><td>27/08/2024 17:22</td><td>27/08/2024 17:31</td><td>1.72478e+12</td><td>1.72478e+12</td><td>2024-08-27 17:22:00</td><td>Tuesday  </td><td>17</td></tr>\n",
       "\t<tr><td>f8f5477f5a2e53616ae37421b1c660b971192bd8ff77e3398304c7ae42581fdc</td><td>12/06/2024 23:13</td><td>12/06/2024 23:32</td><td>1.71823e+12</td><td>1.71824e+12</td><td>2024-06-12 23:13:00</td><td>Wednesday</td><td>23</td></tr>\n",
       "\t<tr><td>b622593d2ef8b337dc554acb307d04a88114f2bf453b18fb5d2c80052aeb2319</td><td>10/09/2024 00:20</td><td>10/09/2024 04:34</td><td>1.72593e+12</td><td>1.72594e+12</td><td>2024-09-10 00:20:00</td><td>Tuesday  </td><td> 0</td></tr>\n",
       "\t<tr><td>b622593d2ef8b337dc554acb307d04a88114f2bf453b18fb5d2c80052aeb2319</td><td>04/08/2024 04:29</td><td>04/08/2024 08:01</td><td>1.72275e+12</td><td>1.72276e+12</td><td>2024-08-04 04:29:00</td><td>Sunday   </td><td> 4</td></tr>\n",
       "\t<tr><td>f8f5477f5a2e53616ae37421b1c660b971192bd8ff77e3398304c7ae42581fdc</td><td>09/08/2024 02:43</td><td>09/08/2024 03:14</td><td>1.72317e+12</td><td>1.72317e+12</td><td>2024-08-09 02:43:00</td><td>Friday   </td><td> 2</td></tr>\n",
       "\t<tr><td>fd6563a4e0f6f4273580e5fedbd8dda64990447aea5a33cbb5e894a3867ca44d</td><td>23/05/2024 18:51</td><td>23/05/2024 18:58</td><td>1.71649e+12</td><td>1.71649e+12</td><td>2024-05-23 18:51:00</td><td>Thursday </td><td>18</td></tr>\n",
       "\t<tr><td>18936844e06b6c7871dce06384e2d142dd86756941641ef39cf40a9967ea14e3</td><td>25/06/2024 01:08</td><td>25/06/2024 02:18</td><td>1.71928e+12</td><td>1.71928e+12</td><td>2024-06-25 01:08:00</td><td>Tuesday  </td><td> 1</td></tr>\n",
       "\t<tr><td>f8f5477f5a2e53616ae37421b1c660b971192bd8ff77e3398304c7ae42581fdc</td><td>19/05/2024 15:05</td><td>19/05/2024 17:02</td><td>1.71613e+12</td><td>1.71614e+12</td><td>2024-05-19 15:05:00</td><td>Sunday   </td><td>15</td></tr>\n",
       "\t<tr><td>18936844e06b6c7871dce06384e2d142dd86756941641ef39cf40a9967ea14e3</td><td>05/07/2024 04:29</td><td>05/07/2024 04:45</td><td>1.72015e+12</td><td>1.72015e+12</td><td>2024-07-05 04:29:00</td><td>Friday   </td><td> 4</td></tr>\n",
       "\t<tr><td>f8f5477f5a2e53616ae37421b1c660b971192bd8ff77e3398304c7ae42581fdc</td><td>22/06/2024 02:30</td><td>22/06/2024 04:22</td><td>1.71902e+12</td><td>1.71903e+12</td><td>2024-06-22 02:30:00</td><td>Saturday </td><td> 2</td></tr>\n",
       "\t<tr><td>b622593d2ef8b337dc554acb307d04a88114f2bf453b18fb5d2c80052aeb2319</td><td>28/08/2024 23:31</td><td>29/08/2024 00:15</td><td>1.72489e+12</td><td>1.72489e+12</td><td>2024-08-28 23:31:00</td><td>Wednesday</td><td>23</td></tr>\n",
       "\t<tr><td>36d9cbb4c6bc0c1a6911436d2da0d09ec625e43e6552f575d4acc9cf487c4686</td><td>10/05/2024 23:01</td><td>10/05/2024 23:07</td><td>1.71538e+12</td><td>1.71538e+12</td><td>2024-05-10 23:01:00</td><td>Friday   </td><td>23</td></tr>\n",
       "\t<tr><td>7a4686586d290c67179275c7c3dfb4ea02f4d317d9ee0e2cee98baa27877a875</td><td>01/07/2024 04:08</td><td>01/07/2024 04:19</td><td>1.71981e+12</td><td>1.71981e+12</td><td>2024-07-01 04:08:00</td><td>Monday   </td><td> 4</td></tr>\n",
       "\t<tr><td>fd6563a4e0f6f4273580e5fedbd8dda64990447aea5a33cbb5e894a3867ca44d</td><td>28/07/2024 15:36</td><td>28/07/2024 15:57</td><td>1.72218e+12</td><td>1.72218e+12</td><td>2024-07-28 15:36:00</td><td>Sunday   </td><td>15</td></tr>\n",
       "\t<tr><td>fd6563a4e0f6f4273580e5fedbd8dda64990447aea5a33cbb5e894a3867ca44d</td><td>25/07/2024 06:15</td><td>25/07/2024 06:22</td><td>1.72189e+12</td><td>1.72189e+12</td><td>2024-07-25 06:15:00</td><td>Thursday </td><td> 6</td></tr>\n",
       "\t<tr><td>36d9cbb4c6bc0c1a6911436d2da0d09ec625e43e6552f575d4acc9cf487c4686</td><td>20/05/2024 02:26</td><td>20/05/2024 02:45</td><td>1.71617e+12</td><td>1.71617e+12</td><td>2024-05-20 02:26:00</td><td>Monday   </td><td> 2</td></tr>\n",
       "</tbody>\n",
       "</table>\n"
      ],
      "text/latex": [
       "A data.frame: 1535 × 8\n",
       "\\begin{tabular}{llllllll}\n",
       " hashedEmail & start\\_time & end\\_time & original\\_start\\_time & original\\_end\\_time & start\\_time\\_parsed & days\\_of\\_week & hours\\_of\\_day\\\\\n",
       " <chr> & <chr> & <chr> & <dbl> & <dbl> & <dttm> & <chr> & <int>\\\\\n",
       "\\hline\n",
       "\t bfce39c89d6549f2bb94d8064d3ce69dc3d7e72b38f431d8aa0c4bf95ccee6bf & 30/06/2024 18:12 & 30/06/2024 18:24 & 1.71977e+12 & 1.71977e+12 & 2024-06-30 18:12:00 & Sunday    & 18\\\\\n",
       "\t 36d9cbb4c6bc0c1a6911436d2da0d09ec625e43e6552f575d4acc9cf487c4686 & 17/06/2024 23:33 & 17/06/2024 23:46 & 1.71867e+12 & 1.71867e+12 & 2024-06-17 23:33:00 & Monday    & 23\\\\\n",
       "\t f8f5477f5a2e53616ae37421b1c660b971192bd8ff77e3398304c7ae42581fdc & 25/07/2024 17:34 & 25/07/2024 17:57 & 1.72193e+12 & 1.72193e+12 & 2024-07-25 17:34:00 & Thursday  & 17\\\\\n",
       "\t bfce39c89d6549f2bb94d8064d3ce69dc3d7e72b38f431d8aa0c4bf95ccee6bf & 25/07/2024 03:22 & 25/07/2024 03:58 & 1.72188e+12 & 1.72188e+12 & 2024-07-25 03:22:00 & Thursday  &  3\\\\\n",
       "\t 36d9cbb4c6bc0c1a6911436d2da0d09ec625e43e6552f575d4acc9cf487c4686 & 25/05/2024 16:01 & 25/05/2024 16:12 & 1.71665e+12 & 1.71665e+12 & 2024-05-25 16:01:00 & Saturday  & 16\\\\\n",
       "\t bfce39c89d6549f2bb94d8064d3ce69dc3d7e72b38f431d8aa0c4bf95ccee6bf & 23/06/2024 15:08 & 23/06/2024 17:10 & 1.71916e+12 & 1.71916e+12 & 2024-06-23 15:08:00 & Sunday    & 15\\\\\n",
       "\t fd6563a4e0f6f4273580e5fedbd8dda64990447aea5a33cbb5e894a3867ca44d & 15/04/2024 07:12 & 15/04/2024 07:21 & 1.71317e+12 & 1.71317e+12 & 2024-04-15 07:12:00 & Monday    &  7\\\\\n",
       "\t ad6390295640af1ed0e45ffc58a53b2d9074b0eea694b16210addd44d7c81f83 & 21/09/2024 02:13 & 21/09/2024 02:30 & 1.72688e+12 & 1.72689e+12 & 2024-09-21 02:13:00 & Saturday  &  2\\\\\n",
       "\t 96e190b0bf3923cd8d349eee467c09d1130af143335779251492eb4c2c058a5f & 21/06/2024 02:31 & 21/06/2024 02:49 & 1.71894e+12 & 1.71894e+12 & 2024-06-21 02:31:00 & Friday    &  2\\\\\n",
       "\t 36d9cbb4c6bc0c1a6911436d2da0d09ec625e43e6552f575d4acc9cf487c4686 & 16/05/2024 05:13 & 16/05/2024 05:52 & 1.71584e+12 & 1.71584e+12 & 2024-05-16 05:13:00 & Thursday  &  5\\\\\n",
       "\t fd6563a4e0f6f4273580e5fedbd8dda64990447aea5a33cbb5e894a3867ca44d & 03/07/2024 01:31 & 03/07/2024 01:35 & 1.71997e+12 & 1.71997e+12 & 2024-07-03 01:31:00 & Wednesday &  1\\\\\n",
       "\t f8f5477f5a2e53616ae37421b1c660b971192bd8ff77e3398304c7ae42581fdc & 30/07/2024 15:15 & 30/07/2024 15:43 & 1.72235e+12 & 1.72235e+12 & 2024-07-30 15:15:00 & Tuesday   & 15\\\\\n",
       "\t f2826fb8dbce4d450348f99cb27ade184b713998d9679780442efaaf218038f2 & 24/08/2024 02:32 & 24/08/2024 03:12 & 1.72447e+12 & 1.72447e+12 & 2024-08-24 02:32:00 & Saturday  &  2\\\\\n",
       "\t b622593d2ef8b337dc554acb307d04a88114f2bf453b18fb5d2c80052aeb2319 & 18/08/2024 00:51 & 18/08/2024 03:15 & 1.72394e+12 & 1.72395e+12 & 2024-08-18 00:51:00 & Sunday    &  0\\\\\n",
       "\t 24d4892c2c3ce11d3e54c3bf31ee218901cac7a2f564911d67424c8fdf0874fe & 23/05/2024 18:12 & 23/05/2024 18:22 & 1.71649e+12 & 1.71649e+12 & 2024-05-23 18:12:00 & Thursday  & 18\\\\\n",
       "\t fd6563a4e0f6f4273580e5fedbd8dda64990447aea5a33cbb5e894a3867ca44d & 11/07/2024 05:20 & 11/07/2024 05:57 & 1.72068e+12 & 1.72068e+12 & 2024-07-11 05:20:00 & Thursday  &  5\\\\\n",
       "\t 88247d9a46fc214a12485dcbcbb03a8ddebfe8c1ec5fe209cd660147625c8e62 & 01/08/2024 23:12 & 01/08/2024 23:23 & 1.72255e+12 & 1.72255e+12 & 2024-08-01 23:12:00 & Thursday  & 23\\\\\n",
       "\t f6daba428a5e19a3d47574858c13550499be23603422e6a0ee9728f8b53e192d & 08/08/2024 00:21 & 08/08/2024 01:35 & 1.72308e+12 & 1.72308e+12 & 2024-08-08 00:21:00 & Thursday  &  0\\\\\n",
       "\t 36d9cbb4c6bc0c1a6911436d2da0d09ec625e43e6552f575d4acc9cf487c4686 & 03/06/2024 00:22 & 03/06/2024 00:33 & 1.71737e+12 & 1.71737e+12 & 2024-06-03 00:22:00 & Monday    &  0\\\\\n",
       "\t fd6563a4e0f6f4273580e5fedbd8dda64990447aea5a33cbb5e894a3867ca44d & 31/07/2024 02:58 & 31/07/2024 03:21 & 1.72239e+12 & 1.72240e+12 & 2024-07-31 02:58:00 & Wednesday &  2\\\\\n",
       "\t bfce39c89d6549f2bb94d8064d3ce69dc3d7e72b38f431d8aa0c4bf95ccee6bf & 04/07/2024 02:25 & 04/07/2024 04:05 & 1.72006e+12 & 1.72007e+12 & 2024-07-04 02:25:00 & Thursday  &  2\\\\\n",
       "\t 36d9cbb4c6bc0c1a6911436d2da0d09ec625e43e6552f575d4acc9cf487c4686 & 07/05/2024 19:23 & 07/05/2024 19:34 & 1.71511e+12 & 1.71511e+12 & 2024-05-07 19:23:00 & Tuesday   & 19\\\\\n",
       "\t fd6563a4e0f6f4273580e5fedbd8dda64990447aea5a33cbb5e894a3867ca44d & 27/06/2024 21:40 & 27/06/2024 21:48 & 1.71952e+12 & 1.71952e+12 & 2024-06-27 21:40:00 & Thursday  & 21\\\\\n",
       "\t ad6390295640af1ed0e45ffc58a53b2d9074b0eea694b16210addd44d7c81f83 & 30/05/2024 06:11 & 30/05/2024 06:57 & 1.71705e+12 & 1.71705e+12 & 2024-05-30 06:11:00 & Thursday  &  6\\\\\n",
       "\t ad6390295640af1ed0e45ffc58a53b2d9074b0eea694b16210addd44d7c81f83 & 26/07/2024 23:09 & 26/07/2024 23:16 & 1.72204e+12 & 1.72204e+12 & 2024-07-26 23:09:00 & Friday    & 23\\\\\n",
       "\t fd6563a4e0f6f4273580e5fedbd8dda64990447aea5a33cbb5e894a3867ca44d & 09/07/2024 17:56 & 09/07/2024 18:02 & 1.72055e+12 & 1.72055e+12 & 2024-07-09 17:56:00 & Tuesday   & 17\\\\\n",
       "\t 36d9cbb4c6bc0c1a6911436d2da0d09ec625e43e6552f575d4acc9cf487c4686 & 04/05/2024 21:41 & 04/05/2024 21:50 & 1.71486e+12 & 1.71486e+12 & 2024-05-04 21:41:00 & Saturday  & 21\\\\\n",
       "\t bfce39c89d6549f2bb94d8064d3ce69dc3d7e72b38f431d8aa0c4bf95ccee6bf & 26/06/2024 01:58 & 26/06/2024 03:35 & 1.71937e+12 & 1.71937e+12 & 2024-06-26 01:58:00 & Wednesday &  1\\\\\n",
       "\t b622593d2ef8b337dc554acb307d04a88114f2bf453b18fb5d2c80052aeb2319 & 30/06/2024 16:21 & 30/06/2024 20:32 & 1.71976e+12 & 1.71978e+12 & 2024-06-30 16:21:00 & Sunday    & 16\\\\\n",
       "\t fd6563a4e0f6f4273580e5fedbd8dda64990447aea5a33cbb5e894a3867ca44d & 22/08/2024 03:02 & 22/08/2024 03:49 & 1.72430e+12 & 1.72430e+12 & 2024-08-22 03:02:00 & Thursday  &  3\\\\\n",
       "\t ⋮ & ⋮ & ⋮ & ⋮ & ⋮ & ⋮ & ⋮ & ⋮\\\\\n",
       "\t ad6390295640af1ed0e45ffc58a53b2d9074b0eea694b16210addd44d7c81f83 & 08/06/2024 16:14 & 08/06/2024 20:25 & 1.71786e+12 & 1.71788e+12 & 2024-06-08 16:14:00 & Saturday  & 16\\\\\n",
       "\t bfce39c89d6549f2bb94d8064d3ce69dc3d7e72b38f431d8aa0c4bf95ccee6bf & 02/06/2024 15:18 & 02/06/2024 16:53 & 1.71734e+12 & 1.71735e+12 & 2024-06-02 15:18:00 & Sunday    & 15\\\\\n",
       "\t bfce39c89d6549f2bb94d8064d3ce69dc3d7e72b38f431d8aa0c4bf95ccee6bf & 22/05/2024 00:51 & 22/05/2024 01:22 & 1.71634e+12 & 1.71634e+12 & 2024-05-22 00:51:00 & Wednesday &  0\\\\\n",
       "\t b3510c708bd50bf9f75e6e02bb6fe14edb705e0ea671ee769a45c613750e8b58 & 29/08/2024 03:42 & 29/08/2024 04:11 & 1.72490e+12 & 1.72490e+12 & 2024-08-29 03:42:00 & Thursday  &  3\\\\\n",
       "\t bfce39c89d6549f2bb94d8064d3ce69dc3d7e72b38f431d8aa0c4bf95ccee6bf & 03/08/2024 22:33 & 04/08/2024 00:51 & 1.72272e+12 & 1.72273e+12 & 2024-08-03 22:33:00 & Saturday  & 22\\\\\n",
       "\t e74c60a92c0100e7240be56d66969db85856152b048c639331a3595f901461ae & 28/08/2024 19:00 & 28/08/2024 20:26 & 1.72487e+12 & 1.72488e+12 & 2024-08-28 19:00:00 & Wednesday & 19\\\\\n",
       "\t b622593d2ef8b337dc554acb307d04a88114f2bf453b18fb5d2c80052aeb2319 & 18/08/2024 21:54 & 19/08/2024 02:09 & 1.72402e+12 & 1.72403e+12 & 2024-08-18 21:54:00 & Sunday    & 21\\\\\n",
       "\t f8f5477f5a2e53616ae37421b1c660b971192bd8ff77e3398304c7ae42581fdc & 23/05/2024 20:04 & 23/05/2024 20:20 & 1.71649e+12 & 1.71650e+12 & 2024-05-23 20:04:00 & Thursday  & 20\\\\\n",
       "\t e74c60a92c0100e7240be56d66969db85856152b048c639331a3595f901461ae & 22/07/2024 08:02 & 22/07/2024 08:07 & 1.72164e+12 & 1.72164e+12 & 2024-07-22 08:02:00 & Monday    &  8\\\\\n",
       "\t fd6563a4e0f6f4273580e5fedbd8dda64990447aea5a33cbb5e894a3867ca44d & 02/06/2024 01:17 & 02/06/2024 01:21 & 1.71729e+12 & 1.71729e+12 & 2024-06-02 01:17:00 & Sunday    &  1\\\\\n",
       "\t f8f5477f5a2e53616ae37421b1c660b971192bd8ff77e3398304c7ae42581fdc & 29/04/2024 04:14 & 29/04/2024 05:34 & 1.71436e+12 & 1.71437e+12 & 2024-04-29 04:14:00 & Monday    &  4\\\\\n",
       "\t a1e0438d568b9c05a93cadaf99969e4d44794d19dea31edd723cbc916f878c33 & 27/04/2024 04:05 & 27/04/2024 05:48 & 1.71419e+12 & 1.71420e+12 & 2024-04-27 04:05:00 & Saturday  &  4\\\\\n",
       "\t fd6563a4e0f6f4273580e5fedbd8dda64990447aea5a33cbb5e894a3867ca44d & 30/07/2024 03:44 & 30/07/2024 03:54 & 1.72231e+12 & 1.72231e+12 & 2024-07-30 03:44:00 & Tuesday   &  3\\\\\n",
       "\t 36d9cbb4c6bc0c1a6911436d2da0d09ec625e43e6552f575d4acc9cf487c4686 & 28/05/2024 03:58 & 28/05/2024 04:04 & 1.71687e+12 & 1.71687e+12 & 2024-05-28 03:58:00 & Tuesday   &  3\\\\\n",
       "\t 55d24216db39c27e1f17cc43d3127cbf8ed76ada6d098202b53ded319855e2c1 & 27/08/2024 17:22 & 27/08/2024 17:31 & 1.72478e+12 & 1.72478e+12 & 2024-08-27 17:22:00 & Tuesday   & 17\\\\\n",
       "\t f8f5477f5a2e53616ae37421b1c660b971192bd8ff77e3398304c7ae42581fdc & 12/06/2024 23:13 & 12/06/2024 23:32 & 1.71823e+12 & 1.71824e+12 & 2024-06-12 23:13:00 & Wednesday & 23\\\\\n",
       "\t b622593d2ef8b337dc554acb307d04a88114f2bf453b18fb5d2c80052aeb2319 & 10/09/2024 00:20 & 10/09/2024 04:34 & 1.72593e+12 & 1.72594e+12 & 2024-09-10 00:20:00 & Tuesday   &  0\\\\\n",
       "\t b622593d2ef8b337dc554acb307d04a88114f2bf453b18fb5d2c80052aeb2319 & 04/08/2024 04:29 & 04/08/2024 08:01 & 1.72275e+12 & 1.72276e+12 & 2024-08-04 04:29:00 & Sunday    &  4\\\\\n",
       "\t f8f5477f5a2e53616ae37421b1c660b971192bd8ff77e3398304c7ae42581fdc & 09/08/2024 02:43 & 09/08/2024 03:14 & 1.72317e+12 & 1.72317e+12 & 2024-08-09 02:43:00 & Friday    &  2\\\\\n",
       "\t fd6563a4e0f6f4273580e5fedbd8dda64990447aea5a33cbb5e894a3867ca44d & 23/05/2024 18:51 & 23/05/2024 18:58 & 1.71649e+12 & 1.71649e+12 & 2024-05-23 18:51:00 & Thursday  & 18\\\\\n",
       "\t 18936844e06b6c7871dce06384e2d142dd86756941641ef39cf40a9967ea14e3 & 25/06/2024 01:08 & 25/06/2024 02:18 & 1.71928e+12 & 1.71928e+12 & 2024-06-25 01:08:00 & Tuesday   &  1\\\\\n",
       "\t f8f5477f5a2e53616ae37421b1c660b971192bd8ff77e3398304c7ae42581fdc & 19/05/2024 15:05 & 19/05/2024 17:02 & 1.71613e+12 & 1.71614e+12 & 2024-05-19 15:05:00 & Sunday    & 15\\\\\n",
       "\t 18936844e06b6c7871dce06384e2d142dd86756941641ef39cf40a9967ea14e3 & 05/07/2024 04:29 & 05/07/2024 04:45 & 1.72015e+12 & 1.72015e+12 & 2024-07-05 04:29:00 & Friday    &  4\\\\\n",
       "\t f8f5477f5a2e53616ae37421b1c660b971192bd8ff77e3398304c7ae42581fdc & 22/06/2024 02:30 & 22/06/2024 04:22 & 1.71902e+12 & 1.71903e+12 & 2024-06-22 02:30:00 & Saturday  &  2\\\\\n",
       "\t b622593d2ef8b337dc554acb307d04a88114f2bf453b18fb5d2c80052aeb2319 & 28/08/2024 23:31 & 29/08/2024 00:15 & 1.72489e+12 & 1.72489e+12 & 2024-08-28 23:31:00 & Wednesday & 23\\\\\n",
       "\t 36d9cbb4c6bc0c1a6911436d2da0d09ec625e43e6552f575d4acc9cf487c4686 & 10/05/2024 23:01 & 10/05/2024 23:07 & 1.71538e+12 & 1.71538e+12 & 2024-05-10 23:01:00 & Friday    & 23\\\\\n",
       "\t 7a4686586d290c67179275c7c3dfb4ea02f4d317d9ee0e2cee98baa27877a875 & 01/07/2024 04:08 & 01/07/2024 04:19 & 1.71981e+12 & 1.71981e+12 & 2024-07-01 04:08:00 & Monday    &  4\\\\\n",
       "\t fd6563a4e0f6f4273580e5fedbd8dda64990447aea5a33cbb5e894a3867ca44d & 28/07/2024 15:36 & 28/07/2024 15:57 & 1.72218e+12 & 1.72218e+12 & 2024-07-28 15:36:00 & Sunday    & 15\\\\\n",
       "\t fd6563a4e0f6f4273580e5fedbd8dda64990447aea5a33cbb5e894a3867ca44d & 25/07/2024 06:15 & 25/07/2024 06:22 & 1.72189e+12 & 1.72189e+12 & 2024-07-25 06:15:00 & Thursday  &  6\\\\\n",
       "\t 36d9cbb4c6bc0c1a6911436d2da0d09ec625e43e6552f575d4acc9cf487c4686 & 20/05/2024 02:26 & 20/05/2024 02:45 & 1.71617e+12 & 1.71617e+12 & 2024-05-20 02:26:00 & Monday    &  2\\\\\n",
       "\\end{tabular}\n"
      ],
      "text/markdown": [
       "\n",
       "A data.frame: 1535 × 8\n",
       "\n",
       "| hashedEmail &lt;chr&gt; | start_time &lt;chr&gt; | end_time &lt;chr&gt; | original_start_time &lt;dbl&gt; | original_end_time &lt;dbl&gt; | start_time_parsed &lt;dttm&gt; | days_of_week &lt;chr&gt; | hours_of_day &lt;int&gt; |\n",
       "|---|---|---|---|---|---|---|---|\n",
       "| bfce39c89d6549f2bb94d8064d3ce69dc3d7e72b38f431d8aa0c4bf95ccee6bf | 30/06/2024 18:12 | 30/06/2024 18:24 | 1.71977e+12 | 1.71977e+12 | 2024-06-30 18:12:00 | Sunday    | 18 |\n",
       "| 36d9cbb4c6bc0c1a6911436d2da0d09ec625e43e6552f575d4acc9cf487c4686 | 17/06/2024 23:33 | 17/06/2024 23:46 | 1.71867e+12 | 1.71867e+12 | 2024-06-17 23:33:00 | Monday    | 23 |\n",
       "| f8f5477f5a2e53616ae37421b1c660b971192bd8ff77e3398304c7ae42581fdc | 25/07/2024 17:34 | 25/07/2024 17:57 | 1.72193e+12 | 1.72193e+12 | 2024-07-25 17:34:00 | Thursday  | 17 |\n",
       "| bfce39c89d6549f2bb94d8064d3ce69dc3d7e72b38f431d8aa0c4bf95ccee6bf | 25/07/2024 03:22 | 25/07/2024 03:58 | 1.72188e+12 | 1.72188e+12 | 2024-07-25 03:22:00 | Thursday  |  3 |\n",
       "| 36d9cbb4c6bc0c1a6911436d2da0d09ec625e43e6552f575d4acc9cf487c4686 | 25/05/2024 16:01 | 25/05/2024 16:12 | 1.71665e+12 | 1.71665e+12 | 2024-05-25 16:01:00 | Saturday  | 16 |\n",
       "| bfce39c89d6549f2bb94d8064d3ce69dc3d7e72b38f431d8aa0c4bf95ccee6bf | 23/06/2024 15:08 | 23/06/2024 17:10 | 1.71916e+12 | 1.71916e+12 | 2024-06-23 15:08:00 | Sunday    | 15 |\n",
       "| fd6563a4e0f6f4273580e5fedbd8dda64990447aea5a33cbb5e894a3867ca44d | 15/04/2024 07:12 | 15/04/2024 07:21 | 1.71317e+12 | 1.71317e+12 | 2024-04-15 07:12:00 | Monday    |  7 |\n",
       "| ad6390295640af1ed0e45ffc58a53b2d9074b0eea694b16210addd44d7c81f83 | 21/09/2024 02:13 | 21/09/2024 02:30 | 1.72688e+12 | 1.72689e+12 | 2024-09-21 02:13:00 | Saturday  |  2 |\n",
       "| 96e190b0bf3923cd8d349eee467c09d1130af143335779251492eb4c2c058a5f | 21/06/2024 02:31 | 21/06/2024 02:49 | 1.71894e+12 | 1.71894e+12 | 2024-06-21 02:31:00 | Friday    |  2 |\n",
       "| 36d9cbb4c6bc0c1a6911436d2da0d09ec625e43e6552f575d4acc9cf487c4686 | 16/05/2024 05:13 | 16/05/2024 05:52 | 1.71584e+12 | 1.71584e+12 | 2024-05-16 05:13:00 | Thursday  |  5 |\n",
       "| fd6563a4e0f6f4273580e5fedbd8dda64990447aea5a33cbb5e894a3867ca44d | 03/07/2024 01:31 | 03/07/2024 01:35 | 1.71997e+12 | 1.71997e+12 | 2024-07-03 01:31:00 | Wednesday |  1 |\n",
       "| f8f5477f5a2e53616ae37421b1c660b971192bd8ff77e3398304c7ae42581fdc | 30/07/2024 15:15 | 30/07/2024 15:43 | 1.72235e+12 | 1.72235e+12 | 2024-07-30 15:15:00 | Tuesday   | 15 |\n",
       "| f2826fb8dbce4d450348f99cb27ade184b713998d9679780442efaaf218038f2 | 24/08/2024 02:32 | 24/08/2024 03:12 | 1.72447e+12 | 1.72447e+12 | 2024-08-24 02:32:00 | Saturday  |  2 |\n",
       "| b622593d2ef8b337dc554acb307d04a88114f2bf453b18fb5d2c80052aeb2319 | 18/08/2024 00:51 | 18/08/2024 03:15 | 1.72394e+12 | 1.72395e+12 | 2024-08-18 00:51:00 | Sunday    |  0 |\n",
       "| 24d4892c2c3ce11d3e54c3bf31ee218901cac7a2f564911d67424c8fdf0874fe | 23/05/2024 18:12 | 23/05/2024 18:22 | 1.71649e+12 | 1.71649e+12 | 2024-05-23 18:12:00 | Thursday  | 18 |\n",
       "| fd6563a4e0f6f4273580e5fedbd8dda64990447aea5a33cbb5e894a3867ca44d | 11/07/2024 05:20 | 11/07/2024 05:57 | 1.72068e+12 | 1.72068e+12 | 2024-07-11 05:20:00 | Thursday  |  5 |\n",
       "| 88247d9a46fc214a12485dcbcbb03a8ddebfe8c1ec5fe209cd660147625c8e62 | 01/08/2024 23:12 | 01/08/2024 23:23 | 1.72255e+12 | 1.72255e+12 | 2024-08-01 23:12:00 | Thursday  | 23 |\n",
       "| f6daba428a5e19a3d47574858c13550499be23603422e6a0ee9728f8b53e192d | 08/08/2024 00:21 | 08/08/2024 01:35 | 1.72308e+12 | 1.72308e+12 | 2024-08-08 00:21:00 | Thursday  |  0 |\n",
       "| 36d9cbb4c6bc0c1a6911436d2da0d09ec625e43e6552f575d4acc9cf487c4686 | 03/06/2024 00:22 | 03/06/2024 00:33 | 1.71737e+12 | 1.71737e+12 | 2024-06-03 00:22:00 | Monday    |  0 |\n",
       "| fd6563a4e0f6f4273580e5fedbd8dda64990447aea5a33cbb5e894a3867ca44d | 31/07/2024 02:58 | 31/07/2024 03:21 | 1.72239e+12 | 1.72240e+12 | 2024-07-31 02:58:00 | Wednesday |  2 |\n",
       "| bfce39c89d6549f2bb94d8064d3ce69dc3d7e72b38f431d8aa0c4bf95ccee6bf | 04/07/2024 02:25 | 04/07/2024 04:05 | 1.72006e+12 | 1.72007e+12 | 2024-07-04 02:25:00 | Thursday  |  2 |\n",
       "| 36d9cbb4c6bc0c1a6911436d2da0d09ec625e43e6552f575d4acc9cf487c4686 | 07/05/2024 19:23 | 07/05/2024 19:34 | 1.71511e+12 | 1.71511e+12 | 2024-05-07 19:23:00 | Tuesday   | 19 |\n",
       "| fd6563a4e0f6f4273580e5fedbd8dda64990447aea5a33cbb5e894a3867ca44d | 27/06/2024 21:40 | 27/06/2024 21:48 | 1.71952e+12 | 1.71952e+12 | 2024-06-27 21:40:00 | Thursday  | 21 |\n",
       "| ad6390295640af1ed0e45ffc58a53b2d9074b0eea694b16210addd44d7c81f83 | 30/05/2024 06:11 | 30/05/2024 06:57 | 1.71705e+12 | 1.71705e+12 | 2024-05-30 06:11:00 | Thursday  |  6 |\n",
       "| ad6390295640af1ed0e45ffc58a53b2d9074b0eea694b16210addd44d7c81f83 | 26/07/2024 23:09 | 26/07/2024 23:16 | 1.72204e+12 | 1.72204e+12 | 2024-07-26 23:09:00 | Friday    | 23 |\n",
       "| fd6563a4e0f6f4273580e5fedbd8dda64990447aea5a33cbb5e894a3867ca44d | 09/07/2024 17:56 | 09/07/2024 18:02 | 1.72055e+12 | 1.72055e+12 | 2024-07-09 17:56:00 | Tuesday   | 17 |\n",
       "| 36d9cbb4c6bc0c1a6911436d2da0d09ec625e43e6552f575d4acc9cf487c4686 | 04/05/2024 21:41 | 04/05/2024 21:50 | 1.71486e+12 | 1.71486e+12 | 2024-05-04 21:41:00 | Saturday  | 21 |\n",
       "| bfce39c89d6549f2bb94d8064d3ce69dc3d7e72b38f431d8aa0c4bf95ccee6bf | 26/06/2024 01:58 | 26/06/2024 03:35 | 1.71937e+12 | 1.71937e+12 | 2024-06-26 01:58:00 | Wednesday |  1 |\n",
       "| b622593d2ef8b337dc554acb307d04a88114f2bf453b18fb5d2c80052aeb2319 | 30/06/2024 16:21 | 30/06/2024 20:32 | 1.71976e+12 | 1.71978e+12 | 2024-06-30 16:21:00 | Sunday    | 16 |\n",
       "| fd6563a4e0f6f4273580e5fedbd8dda64990447aea5a33cbb5e894a3867ca44d | 22/08/2024 03:02 | 22/08/2024 03:49 | 1.72430e+12 | 1.72430e+12 | 2024-08-22 03:02:00 | Thursday  |  3 |\n",
       "| ⋮ | ⋮ | ⋮ | ⋮ | ⋮ | ⋮ | ⋮ | ⋮ |\n",
       "| ad6390295640af1ed0e45ffc58a53b2d9074b0eea694b16210addd44d7c81f83 | 08/06/2024 16:14 | 08/06/2024 20:25 | 1.71786e+12 | 1.71788e+12 | 2024-06-08 16:14:00 | Saturday  | 16 |\n",
       "| bfce39c89d6549f2bb94d8064d3ce69dc3d7e72b38f431d8aa0c4bf95ccee6bf | 02/06/2024 15:18 | 02/06/2024 16:53 | 1.71734e+12 | 1.71735e+12 | 2024-06-02 15:18:00 | Sunday    | 15 |\n",
       "| bfce39c89d6549f2bb94d8064d3ce69dc3d7e72b38f431d8aa0c4bf95ccee6bf | 22/05/2024 00:51 | 22/05/2024 01:22 | 1.71634e+12 | 1.71634e+12 | 2024-05-22 00:51:00 | Wednesday |  0 |\n",
       "| b3510c708bd50bf9f75e6e02bb6fe14edb705e0ea671ee769a45c613750e8b58 | 29/08/2024 03:42 | 29/08/2024 04:11 | 1.72490e+12 | 1.72490e+12 | 2024-08-29 03:42:00 | Thursday  |  3 |\n",
       "| bfce39c89d6549f2bb94d8064d3ce69dc3d7e72b38f431d8aa0c4bf95ccee6bf | 03/08/2024 22:33 | 04/08/2024 00:51 | 1.72272e+12 | 1.72273e+12 | 2024-08-03 22:33:00 | Saturday  | 22 |\n",
       "| e74c60a92c0100e7240be56d66969db85856152b048c639331a3595f901461ae | 28/08/2024 19:00 | 28/08/2024 20:26 | 1.72487e+12 | 1.72488e+12 | 2024-08-28 19:00:00 | Wednesday | 19 |\n",
       "| b622593d2ef8b337dc554acb307d04a88114f2bf453b18fb5d2c80052aeb2319 | 18/08/2024 21:54 | 19/08/2024 02:09 | 1.72402e+12 | 1.72403e+12 | 2024-08-18 21:54:00 | Sunday    | 21 |\n",
       "| f8f5477f5a2e53616ae37421b1c660b971192bd8ff77e3398304c7ae42581fdc | 23/05/2024 20:04 | 23/05/2024 20:20 | 1.71649e+12 | 1.71650e+12 | 2024-05-23 20:04:00 | Thursday  | 20 |\n",
       "| e74c60a92c0100e7240be56d66969db85856152b048c639331a3595f901461ae | 22/07/2024 08:02 | 22/07/2024 08:07 | 1.72164e+12 | 1.72164e+12 | 2024-07-22 08:02:00 | Monday    |  8 |\n",
       "| fd6563a4e0f6f4273580e5fedbd8dda64990447aea5a33cbb5e894a3867ca44d | 02/06/2024 01:17 | 02/06/2024 01:21 | 1.71729e+12 | 1.71729e+12 | 2024-06-02 01:17:00 | Sunday    |  1 |\n",
       "| f8f5477f5a2e53616ae37421b1c660b971192bd8ff77e3398304c7ae42581fdc | 29/04/2024 04:14 | 29/04/2024 05:34 | 1.71436e+12 | 1.71437e+12 | 2024-04-29 04:14:00 | Monday    |  4 |\n",
       "| a1e0438d568b9c05a93cadaf99969e4d44794d19dea31edd723cbc916f878c33 | 27/04/2024 04:05 | 27/04/2024 05:48 | 1.71419e+12 | 1.71420e+12 | 2024-04-27 04:05:00 | Saturday  |  4 |\n",
       "| fd6563a4e0f6f4273580e5fedbd8dda64990447aea5a33cbb5e894a3867ca44d | 30/07/2024 03:44 | 30/07/2024 03:54 | 1.72231e+12 | 1.72231e+12 | 2024-07-30 03:44:00 | Tuesday   |  3 |\n",
       "| 36d9cbb4c6bc0c1a6911436d2da0d09ec625e43e6552f575d4acc9cf487c4686 | 28/05/2024 03:58 | 28/05/2024 04:04 | 1.71687e+12 | 1.71687e+12 | 2024-05-28 03:58:00 | Tuesday   |  3 |\n",
       "| 55d24216db39c27e1f17cc43d3127cbf8ed76ada6d098202b53ded319855e2c1 | 27/08/2024 17:22 | 27/08/2024 17:31 | 1.72478e+12 | 1.72478e+12 | 2024-08-27 17:22:00 | Tuesday   | 17 |\n",
       "| f8f5477f5a2e53616ae37421b1c660b971192bd8ff77e3398304c7ae42581fdc | 12/06/2024 23:13 | 12/06/2024 23:32 | 1.71823e+12 | 1.71824e+12 | 2024-06-12 23:13:00 | Wednesday | 23 |\n",
       "| b622593d2ef8b337dc554acb307d04a88114f2bf453b18fb5d2c80052aeb2319 | 10/09/2024 00:20 | 10/09/2024 04:34 | 1.72593e+12 | 1.72594e+12 | 2024-09-10 00:20:00 | Tuesday   |  0 |\n",
       "| b622593d2ef8b337dc554acb307d04a88114f2bf453b18fb5d2c80052aeb2319 | 04/08/2024 04:29 | 04/08/2024 08:01 | 1.72275e+12 | 1.72276e+12 | 2024-08-04 04:29:00 | Sunday    |  4 |\n",
       "| f8f5477f5a2e53616ae37421b1c660b971192bd8ff77e3398304c7ae42581fdc | 09/08/2024 02:43 | 09/08/2024 03:14 | 1.72317e+12 | 1.72317e+12 | 2024-08-09 02:43:00 | Friday    |  2 |\n",
       "| fd6563a4e0f6f4273580e5fedbd8dda64990447aea5a33cbb5e894a3867ca44d | 23/05/2024 18:51 | 23/05/2024 18:58 | 1.71649e+12 | 1.71649e+12 | 2024-05-23 18:51:00 | Thursday  | 18 |\n",
       "| 18936844e06b6c7871dce06384e2d142dd86756941641ef39cf40a9967ea14e3 | 25/06/2024 01:08 | 25/06/2024 02:18 | 1.71928e+12 | 1.71928e+12 | 2024-06-25 01:08:00 | Tuesday   |  1 |\n",
       "| f8f5477f5a2e53616ae37421b1c660b971192bd8ff77e3398304c7ae42581fdc | 19/05/2024 15:05 | 19/05/2024 17:02 | 1.71613e+12 | 1.71614e+12 | 2024-05-19 15:05:00 | Sunday    | 15 |\n",
       "| 18936844e06b6c7871dce06384e2d142dd86756941641ef39cf40a9967ea14e3 | 05/07/2024 04:29 | 05/07/2024 04:45 | 1.72015e+12 | 1.72015e+12 | 2024-07-05 04:29:00 | Friday    |  4 |\n",
       "| f8f5477f5a2e53616ae37421b1c660b971192bd8ff77e3398304c7ae42581fdc | 22/06/2024 02:30 | 22/06/2024 04:22 | 1.71902e+12 | 1.71903e+12 | 2024-06-22 02:30:00 | Saturday  |  2 |\n",
       "| b622593d2ef8b337dc554acb307d04a88114f2bf453b18fb5d2c80052aeb2319 | 28/08/2024 23:31 | 29/08/2024 00:15 | 1.72489e+12 | 1.72489e+12 | 2024-08-28 23:31:00 | Wednesday | 23 |\n",
       "| 36d9cbb4c6bc0c1a6911436d2da0d09ec625e43e6552f575d4acc9cf487c4686 | 10/05/2024 23:01 | 10/05/2024 23:07 | 1.71538e+12 | 1.71538e+12 | 2024-05-10 23:01:00 | Friday    | 23 |\n",
       "| 7a4686586d290c67179275c7c3dfb4ea02f4d317d9ee0e2cee98baa27877a875 | 01/07/2024 04:08 | 01/07/2024 04:19 | 1.71981e+12 | 1.71981e+12 | 2024-07-01 04:08:00 | Monday    |  4 |\n",
       "| fd6563a4e0f6f4273580e5fedbd8dda64990447aea5a33cbb5e894a3867ca44d | 28/07/2024 15:36 | 28/07/2024 15:57 | 1.72218e+12 | 1.72218e+12 | 2024-07-28 15:36:00 | Sunday    | 15 |\n",
       "| fd6563a4e0f6f4273580e5fedbd8dda64990447aea5a33cbb5e894a3867ca44d | 25/07/2024 06:15 | 25/07/2024 06:22 | 1.72189e+12 | 1.72189e+12 | 2024-07-25 06:15:00 | Thursday  |  6 |\n",
       "| 36d9cbb4c6bc0c1a6911436d2da0d09ec625e43e6552f575d4acc9cf487c4686 | 20/05/2024 02:26 | 20/05/2024 02:45 | 1.71617e+12 | 1.71617e+12 | 2024-05-20 02:26:00 | Monday    |  2 |\n",
       "\n"
      ],
      "text/plain": [
       "     hashedEmail                                                     \n",
       "1    bfce39c89d6549f2bb94d8064d3ce69dc3d7e72b38f431d8aa0c4bf95ccee6bf\n",
       "2    36d9cbb4c6bc0c1a6911436d2da0d09ec625e43e6552f575d4acc9cf487c4686\n",
       "3    f8f5477f5a2e53616ae37421b1c660b971192bd8ff77e3398304c7ae42581fdc\n",
       "4    bfce39c89d6549f2bb94d8064d3ce69dc3d7e72b38f431d8aa0c4bf95ccee6bf\n",
       "5    36d9cbb4c6bc0c1a6911436d2da0d09ec625e43e6552f575d4acc9cf487c4686\n",
       "6    bfce39c89d6549f2bb94d8064d3ce69dc3d7e72b38f431d8aa0c4bf95ccee6bf\n",
       "7    fd6563a4e0f6f4273580e5fedbd8dda64990447aea5a33cbb5e894a3867ca44d\n",
       "8    ad6390295640af1ed0e45ffc58a53b2d9074b0eea694b16210addd44d7c81f83\n",
       "9    96e190b0bf3923cd8d349eee467c09d1130af143335779251492eb4c2c058a5f\n",
       "10   36d9cbb4c6bc0c1a6911436d2da0d09ec625e43e6552f575d4acc9cf487c4686\n",
       "11   fd6563a4e0f6f4273580e5fedbd8dda64990447aea5a33cbb5e894a3867ca44d\n",
       "12   f8f5477f5a2e53616ae37421b1c660b971192bd8ff77e3398304c7ae42581fdc\n",
       "13   f2826fb8dbce4d450348f99cb27ade184b713998d9679780442efaaf218038f2\n",
       "14   b622593d2ef8b337dc554acb307d04a88114f2bf453b18fb5d2c80052aeb2319\n",
       "15   24d4892c2c3ce11d3e54c3bf31ee218901cac7a2f564911d67424c8fdf0874fe\n",
       "16   fd6563a4e0f6f4273580e5fedbd8dda64990447aea5a33cbb5e894a3867ca44d\n",
       "17   88247d9a46fc214a12485dcbcbb03a8ddebfe8c1ec5fe209cd660147625c8e62\n",
       "18   f6daba428a5e19a3d47574858c13550499be23603422e6a0ee9728f8b53e192d\n",
       "19   36d9cbb4c6bc0c1a6911436d2da0d09ec625e43e6552f575d4acc9cf487c4686\n",
       "20   fd6563a4e0f6f4273580e5fedbd8dda64990447aea5a33cbb5e894a3867ca44d\n",
       "21   bfce39c89d6549f2bb94d8064d3ce69dc3d7e72b38f431d8aa0c4bf95ccee6bf\n",
       "22   36d9cbb4c6bc0c1a6911436d2da0d09ec625e43e6552f575d4acc9cf487c4686\n",
       "23   fd6563a4e0f6f4273580e5fedbd8dda64990447aea5a33cbb5e894a3867ca44d\n",
       "24   ad6390295640af1ed0e45ffc58a53b2d9074b0eea694b16210addd44d7c81f83\n",
       "25   ad6390295640af1ed0e45ffc58a53b2d9074b0eea694b16210addd44d7c81f83\n",
       "26   fd6563a4e0f6f4273580e5fedbd8dda64990447aea5a33cbb5e894a3867ca44d\n",
       "27   36d9cbb4c6bc0c1a6911436d2da0d09ec625e43e6552f575d4acc9cf487c4686\n",
       "28   bfce39c89d6549f2bb94d8064d3ce69dc3d7e72b38f431d8aa0c4bf95ccee6bf\n",
       "29   b622593d2ef8b337dc554acb307d04a88114f2bf453b18fb5d2c80052aeb2319\n",
       "30   fd6563a4e0f6f4273580e5fedbd8dda64990447aea5a33cbb5e894a3867ca44d\n",
       "⋮    ⋮                                                               \n",
       "1506 ad6390295640af1ed0e45ffc58a53b2d9074b0eea694b16210addd44d7c81f83\n",
       "1507 bfce39c89d6549f2bb94d8064d3ce69dc3d7e72b38f431d8aa0c4bf95ccee6bf\n",
       "1508 bfce39c89d6549f2bb94d8064d3ce69dc3d7e72b38f431d8aa0c4bf95ccee6bf\n",
       "1509 b3510c708bd50bf9f75e6e02bb6fe14edb705e0ea671ee769a45c613750e8b58\n",
       "1510 bfce39c89d6549f2bb94d8064d3ce69dc3d7e72b38f431d8aa0c4bf95ccee6bf\n",
       "1511 e74c60a92c0100e7240be56d66969db85856152b048c639331a3595f901461ae\n",
       "1512 b622593d2ef8b337dc554acb307d04a88114f2bf453b18fb5d2c80052aeb2319\n",
       "1513 f8f5477f5a2e53616ae37421b1c660b971192bd8ff77e3398304c7ae42581fdc\n",
       "1514 e74c60a92c0100e7240be56d66969db85856152b048c639331a3595f901461ae\n",
       "1515 fd6563a4e0f6f4273580e5fedbd8dda64990447aea5a33cbb5e894a3867ca44d\n",
       "1516 f8f5477f5a2e53616ae37421b1c660b971192bd8ff77e3398304c7ae42581fdc\n",
       "1517 a1e0438d568b9c05a93cadaf99969e4d44794d19dea31edd723cbc916f878c33\n",
       "1518 fd6563a4e0f6f4273580e5fedbd8dda64990447aea5a33cbb5e894a3867ca44d\n",
       "1519 36d9cbb4c6bc0c1a6911436d2da0d09ec625e43e6552f575d4acc9cf487c4686\n",
       "1520 55d24216db39c27e1f17cc43d3127cbf8ed76ada6d098202b53ded319855e2c1\n",
       "1521 f8f5477f5a2e53616ae37421b1c660b971192bd8ff77e3398304c7ae42581fdc\n",
       "1522 b622593d2ef8b337dc554acb307d04a88114f2bf453b18fb5d2c80052aeb2319\n",
       "1523 b622593d2ef8b337dc554acb307d04a88114f2bf453b18fb5d2c80052aeb2319\n",
       "1524 f8f5477f5a2e53616ae37421b1c660b971192bd8ff77e3398304c7ae42581fdc\n",
       "1525 fd6563a4e0f6f4273580e5fedbd8dda64990447aea5a33cbb5e894a3867ca44d\n",
       "1526 18936844e06b6c7871dce06384e2d142dd86756941641ef39cf40a9967ea14e3\n",
       "1527 f8f5477f5a2e53616ae37421b1c660b971192bd8ff77e3398304c7ae42581fdc\n",
       "1528 18936844e06b6c7871dce06384e2d142dd86756941641ef39cf40a9967ea14e3\n",
       "1529 f8f5477f5a2e53616ae37421b1c660b971192bd8ff77e3398304c7ae42581fdc\n",
       "1530 b622593d2ef8b337dc554acb307d04a88114f2bf453b18fb5d2c80052aeb2319\n",
       "1531 36d9cbb4c6bc0c1a6911436d2da0d09ec625e43e6552f575d4acc9cf487c4686\n",
       "1532 7a4686586d290c67179275c7c3dfb4ea02f4d317d9ee0e2cee98baa27877a875\n",
       "1533 fd6563a4e0f6f4273580e5fedbd8dda64990447aea5a33cbb5e894a3867ca44d\n",
       "1534 fd6563a4e0f6f4273580e5fedbd8dda64990447aea5a33cbb5e894a3867ca44d\n",
       "1535 36d9cbb4c6bc0c1a6911436d2da0d09ec625e43e6552f575d4acc9cf487c4686\n",
       "     start_time       end_time         original_start_time original_end_time\n",
       "1    30/06/2024 18:12 30/06/2024 18:24 1.71977e+12         1.71977e+12      \n",
       "2    17/06/2024 23:33 17/06/2024 23:46 1.71867e+12         1.71867e+12      \n",
       "3    25/07/2024 17:34 25/07/2024 17:57 1.72193e+12         1.72193e+12      \n",
       "4    25/07/2024 03:22 25/07/2024 03:58 1.72188e+12         1.72188e+12      \n",
       "5    25/05/2024 16:01 25/05/2024 16:12 1.71665e+12         1.71665e+12      \n",
       "6    23/06/2024 15:08 23/06/2024 17:10 1.71916e+12         1.71916e+12      \n",
       "7    15/04/2024 07:12 15/04/2024 07:21 1.71317e+12         1.71317e+12      \n",
       "8    21/09/2024 02:13 21/09/2024 02:30 1.72688e+12         1.72689e+12      \n",
       "9    21/06/2024 02:31 21/06/2024 02:49 1.71894e+12         1.71894e+12      \n",
       "10   16/05/2024 05:13 16/05/2024 05:52 1.71584e+12         1.71584e+12      \n",
       "11   03/07/2024 01:31 03/07/2024 01:35 1.71997e+12         1.71997e+12      \n",
       "12   30/07/2024 15:15 30/07/2024 15:43 1.72235e+12         1.72235e+12      \n",
       "13   24/08/2024 02:32 24/08/2024 03:12 1.72447e+12         1.72447e+12      \n",
       "14   18/08/2024 00:51 18/08/2024 03:15 1.72394e+12         1.72395e+12      \n",
       "15   23/05/2024 18:12 23/05/2024 18:22 1.71649e+12         1.71649e+12      \n",
       "16   11/07/2024 05:20 11/07/2024 05:57 1.72068e+12         1.72068e+12      \n",
       "17   01/08/2024 23:12 01/08/2024 23:23 1.72255e+12         1.72255e+12      \n",
       "18   08/08/2024 00:21 08/08/2024 01:35 1.72308e+12         1.72308e+12      \n",
       "19   03/06/2024 00:22 03/06/2024 00:33 1.71737e+12         1.71737e+12      \n",
       "20   31/07/2024 02:58 31/07/2024 03:21 1.72239e+12         1.72240e+12      \n",
       "21   04/07/2024 02:25 04/07/2024 04:05 1.72006e+12         1.72007e+12      \n",
       "22   07/05/2024 19:23 07/05/2024 19:34 1.71511e+12         1.71511e+12      \n",
       "23   27/06/2024 21:40 27/06/2024 21:48 1.71952e+12         1.71952e+12      \n",
       "24   30/05/2024 06:11 30/05/2024 06:57 1.71705e+12         1.71705e+12      \n",
       "25   26/07/2024 23:09 26/07/2024 23:16 1.72204e+12         1.72204e+12      \n",
       "26   09/07/2024 17:56 09/07/2024 18:02 1.72055e+12         1.72055e+12      \n",
       "27   04/05/2024 21:41 04/05/2024 21:50 1.71486e+12         1.71486e+12      \n",
       "28   26/06/2024 01:58 26/06/2024 03:35 1.71937e+12         1.71937e+12      \n",
       "29   30/06/2024 16:21 30/06/2024 20:32 1.71976e+12         1.71978e+12      \n",
       "30   22/08/2024 03:02 22/08/2024 03:49 1.72430e+12         1.72430e+12      \n",
       "⋮    ⋮                ⋮                ⋮                   ⋮                \n",
       "1506 08/06/2024 16:14 08/06/2024 20:25 1.71786e+12         1.71788e+12      \n",
       "1507 02/06/2024 15:18 02/06/2024 16:53 1.71734e+12         1.71735e+12      \n",
       "1508 22/05/2024 00:51 22/05/2024 01:22 1.71634e+12         1.71634e+12      \n",
       "1509 29/08/2024 03:42 29/08/2024 04:11 1.72490e+12         1.72490e+12      \n",
       "1510 03/08/2024 22:33 04/08/2024 00:51 1.72272e+12         1.72273e+12      \n",
       "1511 28/08/2024 19:00 28/08/2024 20:26 1.72487e+12         1.72488e+12      \n",
       "1512 18/08/2024 21:54 19/08/2024 02:09 1.72402e+12         1.72403e+12      \n",
       "1513 23/05/2024 20:04 23/05/2024 20:20 1.71649e+12         1.71650e+12      \n",
       "1514 22/07/2024 08:02 22/07/2024 08:07 1.72164e+12         1.72164e+12      \n",
       "1515 02/06/2024 01:17 02/06/2024 01:21 1.71729e+12         1.71729e+12      \n",
       "1516 29/04/2024 04:14 29/04/2024 05:34 1.71436e+12         1.71437e+12      \n",
       "1517 27/04/2024 04:05 27/04/2024 05:48 1.71419e+12         1.71420e+12      \n",
       "1518 30/07/2024 03:44 30/07/2024 03:54 1.72231e+12         1.72231e+12      \n",
       "1519 28/05/2024 03:58 28/05/2024 04:04 1.71687e+12         1.71687e+12      \n",
       "1520 27/08/2024 17:22 27/08/2024 17:31 1.72478e+12         1.72478e+12      \n",
       "1521 12/06/2024 23:13 12/06/2024 23:32 1.71823e+12         1.71824e+12      \n",
       "1522 10/09/2024 00:20 10/09/2024 04:34 1.72593e+12         1.72594e+12      \n",
       "1523 04/08/2024 04:29 04/08/2024 08:01 1.72275e+12         1.72276e+12      \n",
       "1524 09/08/2024 02:43 09/08/2024 03:14 1.72317e+12         1.72317e+12      \n",
       "1525 23/05/2024 18:51 23/05/2024 18:58 1.71649e+12         1.71649e+12      \n",
       "1526 25/06/2024 01:08 25/06/2024 02:18 1.71928e+12         1.71928e+12      \n",
       "1527 19/05/2024 15:05 19/05/2024 17:02 1.71613e+12         1.71614e+12      \n",
       "1528 05/07/2024 04:29 05/07/2024 04:45 1.72015e+12         1.72015e+12      \n",
       "1529 22/06/2024 02:30 22/06/2024 04:22 1.71902e+12         1.71903e+12      \n",
       "1530 28/08/2024 23:31 29/08/2024 00:15 1.72489e+12         1.72489e+12      \n",
       "1531 10/05/2024 23:01 10/05/2024 23:07 1.71538e+12         1.71538e+12      \n",
       "1532 01/07/2024 04:08 01/07/2024 04:19 1.71981e+12         1.71981e+12      \n",
       "1533 28/07/2024 15:36 28/07/2024 15:57 1.72218e+12         1.72218e+12      \n",
       "1534 25/07/2024 06:15 25/07/2024 06:22 1.72189e+12         1.72189e+12      \n",
       "1535 20/05/2024 02:26 20/05/2024 02:45 1.71617e+12         1.71617e+12      \n",
       "     start_time_parsed   days_of_week hours_of_day\n",
       "1    2024-06-30 18:12:00 Sunday       18          \n",
       "2    2024-06-17 23:33:00 Monday       23          \n",
       "3    2024-07-25 17:34:00 Thursday     17          \n",
       "4    2024-07-25 03:22:00 Thursday      3          \n",
       "5    2024-05-25 16:01:00 Saturday     16          \n",
       "6    2024-06-23 15:08:00 Sunday       15          \n",
       "7    2024-04-15 07:12:00 Monday        7          \n",
       "8    2024-09-21 02:13:00 Saturday      2          \n",
       "9    2024-06-21 02:31:00 Friday        2          \n",
       "10   2024-05-16 05:13:00 Thursday      5          \n",
       "11   2024-07-03 01:31:00 Wednesday     1          \n",
       "12   2024-07-30 15:15:00 Tuesday      15          \n",
       "13   2024-08-24 02:32:00 Saturday      2          \n",
       "14   2024-08-18 00:51:00 Sunday        0          \n",
       "15   2024-05-23 18:12:00 Thursday     18          \n",
       "16   2024-07-11 05:20:00 Thursday      5          \n",
       "17   2024-08-01 23:12:00 Thursday     23          \n",
       "18   2024-08-08 00:21:00 Thursday      0          \n",
       "19   2024-06-03 00:22:00 Monday        0          \n",
       "20   2024-07-31 02:58:00 Wednesday     2          \n",
       "21   2024-07-04 02:25:00 Thursday      2          \n",
       "22   2024-05-07 19:23:00 Tuesday      19          \n",
       "23   2024-06-27 21:40:00 Thursday     21          \n",
       "24   2024-05-30 06:11:00 Thursday      6          \n",
       "25   2024-07-26 23:09:00 Friday       23          \n",
       "26   2024-07-09 17:56:00 Tuesday      17          \n",
       "27   2024-05-04 21:41:00 Saturday     21          \n",
       "28   2024-06-26 01:58:00 Wednesday     1          \n",
       "29   2024-06-30 16:21:00 Sunday       16          \n",
       "30   2024-08-22 03:02:00 Thursday      3          \n",
       "⋮    ⋮                   ⋮            ⋮           \n",
       "1506 2024-06-08 16:14:00 Saturday     16          \n",
       "1507 2024-06-02 15:18:00 Sunday       15          \n",
       "1508 2024-05-22 00:51:00 Wednesday     0          \n",
       "1509 2024-08-29 03:42:00 Thursday      3          \n",
       "1510 2024-08-03 22:33:00 Saturday     22          \n",
       "1511 2024-08-28 19:00:00 Wednesday    19          \n",
       "1512 2024-08-18 21:54:00 Sunday       21          \n",
       "1513 2024-05-23 20:04:00 Thursday     20          \n",
       "1514 2024-07-22 08:02:00 Monday        8          \n",
       "1515 2024-06-02 01:17:00 Sunday        1          \n",
       "1516 2024-04-29 04:14:00 Monday        4          \n",
       "1517 2024-04-27 04:05:00 Saturday      4          \n",
       "1518 2024-07-30 03:44:00 Tuesday       3          \n",
       "1519 2024-05-28 03:58:00 Tuesday       3          \n",
       "1520 2024-08-27 17:22:00 Tuesday      17          \n",
       "1521 2024-06-12 23:13:00 Wednesday    23          \n",
       "1522 2024-09-10 00:20:00 Tuesday       0          \n",
       "1523 2024-08-04 04:29:00 Sunday        4          \n",
       "1524 2024-08-09 02:43:00 Friday        2          \n",
       "1525 2024-05-23 18:51:00 Thursday     18          \n",
       "1526 2024-06-25 01:08:00 Tuesday       1          \n",
       "1527 2024-05-19 15:05:00 Sunday       15          \n",
       "1528 2024-07-05 04:29:00 Friday        4          \n",
       "1529 2024-06-22 02:30:00 Saturday      2          \n",
       "1530 2024-08-28 23:31:00 Wednesday    23          \n",
       "1531 2024-05-10 23:01:00 Friday       23          \n",
       "1532 2024-07-01 04:08:00 Monday        4          \n",
       "1533 2024-07-28 15:36:00 Sunday       15          \n",
       "1534 2024-07-25 06:15:00 Thursday      6          \n",
       "1535 2024-05-20 02:26:00 Monday        2          "
      ]
     },
     "metadata": {},
     "output_type": "display_data"
    }
   ],
   "source": [
    "sessions <- transform(sessions, \n",
    "                     start_time_parsed  = dmy_hm(sessions[[\"start_time\"]])\n",
    "                     )\n",
    "sessions <- transform(sessions,\n",
    "                     days_of_week = weekdays(sessions[[\"start_time_parsed\"]]),\n",
    "                     hours_of_day = hour(sessions[[\"start_time_parsed\"]])\n",
    "                     )\n",
    "sessions"
   ]
  },
  {
   "cell_type": "markdown",
   "id": "fdbd1e74-a7fe-4c99-9003-7227aa54952b",
   "metadata": {},
   "source": [
    "**Explanation**\n",
    "1. I use dmy_hm to parse start_time. This makes the format day-month-year hour:minute.\n",
    "2. When the date-time object is found, I use weekdays() to extract the day of the week for each session. \n",
    "3. I use hour() to extract the hour from the start time. This returns a number representing the hour the session started. "
   ]
  },
  {
   "cell_type": "markdown",
   "id": "365b2f9a-050e-4c6d-a74b-460e8243fdeb",
   "metadata": {},
   "source": [
    "## 3. Exploratory Data Analysis and Visualization"
   ]
  },
  {
   "cell_type": "code",
   "execution_count": null,
   "id": "b074d9a4-aae4-4abc-bf2f-41d6c327875d",
   "metadata": {},
   "outputs": [],
   "source": [
    "# First, I will load the dataset just as a reminder\n",
    "players <- read_csv(\"players.csv\")\n",
    "players"
   ]
  },
  {
   "cell_type": "code",
   "execution_count": null,
   "id": "ec1b567c-2729-48c6-a971-cb0d336df51c",
   "metadata": {},
   "outputs": [],
   "source": [
    "numeric_cols <- sapply(players, is.numeric)\n",
    "\n",
    "num_numeric <- sum(numeric_cols)\n",
    "\n",
    "mean_values <- data.frame(variable = character(num_numeric), mean_value = numeric(num_numeric), stringsAsFactors = FALSE)\n",
    "\n",
    "index <- 1\n",
    "\n",
    "for(i in 1:length(numeric_cols)) {\n",
    "    if (numeric_cols[i]) {\n",
    "        mean_values [index, 1] <- names(players)[i]\n",
    "        mean_values[index, 2] <- round(mean(players[[i]], na.rm = TRUE), 2)\n",
    "        index <- index + 1\n",
    "}\n",
    "    }\n",
    "mean_values"
   ]
  },
  {
   "cell_type": "code",
   "execution_count": null,
   "id": "bdb9d1c2-d1d4-4700-ac78-f6441849cccc",
   "metadata": {},
   "outputs": [],
   "source": [
    "# Distribution of Player Experience\n",
    "ggplot(players, aes(x = experience, fill = experience)) +\n",
    "    geom_bar() +\n",
    "    labs(title = \"Distribution of Player Experience\",\n",
    "         x = \"Experience Level\",\n",
    "         y = \"Number of Players\") +\n",
    "    theme_minimal() +\n",
    "    theme(legend.position = \"none\")"
   ]
  },
  {
   "cell_type": "code",
   "execution_count": null,
   "id": "d96bda3f-81f4-4582-9f95-9bc98a4ceab1",
   "metadata": {},
   "outputs": [],
   "source": [
    "# Played Hours by Experience Level\n",
    "ggplot(players, aes(x = experience, y = played_hours)) +\n",
    "    geom_boxplot(fill = \"pink\") +\n",
    "    labs(title = \"Played Hours by Experience Level\",\n",
    "        x = \"Experience Level\",\n",
    "        y = \"Played hours\") +\n",
    "    theme_minimal()"
   ]
  },
  {
   "cell_type": "code",
   "execution_count": null,
   "id": "bc3aea8f-7f51-4e5f-ac2e-8f48c4afc043",
   "metadata": {},
   "outputs": [],
   "source": [
    "# Age Distribution of Players\n",
    "ggplot(players, aes(x = Age)) +\n",
    "    geom_histogram(binwidth = 5, fill = \"lightblue\", color = \"black\") +\n",
    "    labs(title = \"Distribution of Player Ages\",\n",
    "        x = \"Age\",\n",
    "        y = \"Number of Players\") +\n",
    "    theme_minimal()"
   ]
  },
  {
   "cell_type": "code",
   "execution_count": null,
   "id": "56391d43-4243-4f04-adb8-419652df6b6b",
   "metadata": {},
   "outputs": [],
   "source": [
    "# Played Hours vs Age\n",
    "ggplot(players, aes(x = Age, y = played_hours)) +\n",
    "    geom_point(color = \"red\", alpha = 0.6) +\n",
    "    labs(title = \"Played Hours vs Age\",\n",
    "        x = \"Age\",\n",
    "        y = \"Played Hours\") +\n",
    "    theme_minimal()"
   ]
  },
  {
   "cell_type": "markdown",
   "id": "2d0c33dc-f34f-468d-b3de-9d385804d7f4",
   "metadata": {},
   "source": [
    "**Experience:** Majority of players are amateurs and beginners; the main player base is casual.\n",
    "\n",
    "**Played Hours:** Most players have low activity; majority being under 50, but there are some outliers above 150. The higher playtimes affect averages. \n",
    "\n",
    "**Age:** Majority are young players; there are a few older players who throw off averages. \n",
    "\n",
    "**Potential Issues**:\n",
    " - Extreme hours played affect the analysis\n",
    " - Missing/zero values in age & played_hours\n",
    " - Gender diversity"
   ]
  },
  {
   "cell_type": "markdown",
   "id": "6277ff59-6c75-4898-80ac-6ea30cfccbae",
   "metadata": {},
   "source": [
    "## 4. Methods and Plan\n",
    "**Proposed method:** I will use a linear regression model to examine how player characteristics (experience, age, total hours) predict their performance/engagement in game. It helps determine whether players who spend more time playing achieve higher outcomes/experience. \n",
    "****\n",
    "**Why this method is appropriate:** Linear regression is suitable since the predictor variables (played hours, age) & outcome variables (performance/experience level) are numeric/ordered. This method helps identify the relationships between these variables. \n",
    "****\n",
    "**Assumptions required:** To use linear regression, these assumptions are needed:\n",
    "1. The relationship between predictors\n",
    "2. Each player's data is independent.\n",
    "3. Errors should have equal variances across all fitted values\n",
    "4. Errors should follow a normal distribution.\n",
    "****\n",
    "**Potential limitations/weaknesses:** \n",
    "- Player data contains outliers.\n",
    "- Variables are not numeric, making interpretation hard if categories aren’t included.\n",
    "- Unmeasured factors affect performance, & aren’t included in datasets.\n",
    "****\n",
    "**Model comparison and selection:** Start with a basic linear model, test multiple models, adding/removing predictors. Then compare how well they make sense using plots and checking if the line of best fit matches the data. \n",
    "****\n",
    "**Data processing plan:** \n",
    "- Clean the data by removing missing & invalid values.\n",
    "- Ensure all numeric columns are in the right format.\n",
    "- Split data into a training set to build model & testing set to check.\n",
    "- Split will happen after the cleaning step, so no data will leak between sets."
   ]
  },
  {
   "cell_type": "markdown",
   "id": "35759534-319b-4f76-b16d-937e9c3f0d06",
   "metadata": {},
   "source": [
    "## 5. Github Repository"
   ]
  },
  {
   "cell_type": "markdown",
   "id": "3529827a-bb8a-4f6d-ae8c-7ab33f8ae17f",
   "metadata": {},
   "source": [
    "https://github.com/amandaarenn/DSCI-100-Individual-Project-Planning.git"
   ]
  }
 ],
 "metadata": {
  "kernelspec": {
   "display_name": "R",
   "language": "R",
   "name": "ir"
  },
  "language_info": {
   "codemirror_mode": "r",
   "file_extension": ".r",
   "mimetype": "text/x-r-source",
   "name": "R",
   "pygments_lexer": "r",
   "version": "4.3.3"
  }
 },
 "nbformat": 4,
 "nbformat_minor": 5
}
